{"function":"enableRefunds()","file":"target/packages/contracts/src/Raffle.sol","lines":"L276-L301","analysisFile":"audit-context/functions/08-enableRefunds.md","analysisMarkdown":"## `enableRefunds()` in target/packages/contracts/src/Raffle.sol (L276-L301)\n\n**Purpose:** Transitions an eligible `Active` or `Drawing` raffle into the `Refunding` state after the applicable caller or time condition, reclassifies the entire unsettled sales pot as aggregate refund liability, and announces the initial liability through `RefundsEnabled` (`target/packages/contracts/src/Raffle.sol:L276-L301`). `IRaffle` defines `Refunding` as the state in which full ticket refunds and sponsor prize recovery are available, and describes the sponsor-only early close and permissionless deadline paths (`target/packages/contracts/src/interfaces/IRaffle.sol:L20-L34`, `target/packages/contracts/src/interfaces/IRaffle.sol:L110-L113`, `target/packages/contracts/src/interfaces/IRaffle.sol:L322-L324`). `refundTickets` requires this state, while `releaseSponsorPrize` accepts it as a prize-return state (`target/packages/contracts/src/Raffle.sol:L349-L370`, `target/packages/contracts/src/Raffle.sol:L395-L405`).\n\n---\n\n**Inputs & Assumptions:**\n\n- There are no explicit parameters or return values; the untrusted inputs are `msg.sender` and the transaction's `block.timestamp` (`target/packages/contracts/src/Raffle.sol:L276-L301`).\n- Implicit storage inputs are `status`, `totalEntries`, `sponsor`, `endTime`, `drawRequestedAt`, and `unsettledPot`, declared at `target/packages/contracts/src/Raffle.sol:L61-L94` and `target/packages/contracts/src/Raffle.sol:L109-L124`.\n- Entry requires `status` to be either `Active` or `Drawing`; every other status reverts before the liability writes (`target/packages/contracts/src/Raffle.sol:L279-L294`). The locked implementation itself starts in `Refunding`, while an initialized clone starts in `AwaitingPrize` and becomes `Active` only after the configured prize callback (`target/packages/contracts/src/Raffle.sol:L155-L166`, `target/packages/contracts/src/Raffle.sol:L176-L205`, `target/packages/contracts/src/Raffle.sol:L416-L430`).\n- In `Active` with zero entries, `sponsor` may close immediately; every other caller must wait until `block.timestamp >= endTime` (`target/packages/contracts/src/Raffle.sol:L279-L285`). The factory supplies `sponsor = createRaffle`'s caller, and both interfaces describe that address as the pre-end empty-raffle authority (`target/packages/contracts/src/RaffleFactory.sol:L97-L120`, `target/packages/contracts/src/interfaces/IRaffle.sol:L36-L53`, `target/packages/contracts/src/interfaces/IRaffleFactory.sol:L30-L34`).\n- In `Active` with at least one entry, there is no sponsor exception: any caller must wait until `endTime + 2 days`, returned by `drawRequestDeadline()` (`target/packages/contracts/src/Raffle.sol:L285-L288`, `target/packages/contracts/src/Raffle.sol:L457-L460`, `target/packages/contracts/src/libraries/RaffleConstants.sol:L32-L33`).\n- In `Drawing`, any caller must wait until `drawRequestedAt + 2 days`, returned by `callbackDeadline()` (`target/packages/contracts/src/Raffle.sol:L289-L291`, `target/packages/contracts/src/Raffle.sol:L462-L465`, `target/packages/contracts/src/libraries/RaffleConstants.sol:L35-L36`). `requestDraw` writes `status = Drawing` and `drawRequestedAt` before invoking the wrapper; a reverting request cannot persist those writes, while a completed request leaves both values recorded (`target/packages/contracts/src/Raffle.sol:L240-L260`).\n- The callback deadline represents the full request timestamp only if the explicit `uint64(block.timestamp)` conversion in `requestDraw` preserves the timestamp (`target/packages/contracts/src/Raffle.sol:L252-L254`). No explicit bound at request time establishes this for all possible `uint256` block timestamps; established by: nothing found.\n- On every source-reachable `Active` or `Drawing` entry, the pre-call `remainingRefundLiability` is zero. Its only positive assignment is paired with `status = Refunding` in this function, and its only decrement is gated by `Refunding`; no source transition returns from `Refunding` to `Active` or `Drawing` (`target/packages/contracts/src/Raffle.sol:L296-L299`, `target/packages/contracts/src/Raffle.sol:L349-L370`, `target/packages/contracts/src/Raffle.sol:L416-L430`, `target/packages/contracts/src/Raffle.sol:L509-L523`).\n- The tracked `unsettledPot` corresponds to sold-entry face value: each successful purchase increases `totalEntries` by `entryCount` and `unsettledPot` by `entryCount * ENTRY_PRICE`, while the other zeroing path is settlement, which requires an already resolved `NftWon` or `CashWon` status (`target/packages/contracts/src/Raffle.sol:L215-L233`, `target/packages/contracts/src/Raffle.sol:L533-L555`). Consequently, the successful empty-raffle path records zero refund liability, while the sold paths record the tracked gross sales amount (`target/packages/contracts/src/Raffle.sol:L223-L233`, `target/packages/contracts/src/Raffle.sol:L473-L475`).\n- Paying the resulting liability assumes `unsettledPot` is backed by an equal spendable quote-token balance. `SafeERC20.safeTransferFrom` establishes call/return success but does not measure the received balance delta (`target/packages/contracts/node_modules/@openzeppelin/contracts/token/ERC20/utils/SafeERC20.sol:L43-L46`, `target/packages/contracts/node_modules/@openzeppelin/contracts/token/ERC20/utils/SafeERC20.sol:L212-L240`). The project instead establishes this through its canonical, standard, non-rebasing, fee-free USDC trust and deployment requirement (`target/packages/contracts/src/interfaces/IRaffle.sol:L12-L15`, `target/packages/contracts/src/RaffleFactory.sol:L58-L77`, `target/packages/contracts/src/interfaces/IRaffleFactory.sol:L7-L9`, `target/DESIGN.md:L2`).\n- Interpreting `Refunding` as also enabling meaningful sponsor prize recovery assumes the configured ERC-721 continues to recognize the raffle's custody. The factory verifies ownership and `Active` status immediately after deposit, but this function performs no later custody query (`target/packages/contracts/src/RaffleFactory.sol:L127-L134`, `target/packages/contracts/src/Raffle.sol:L276-L301`). Continued behavior of the untrusted prize contract after that point is established by: nothing found.\n\n---\n\n**Outputs & Effects:**\n\n- Returns no value and makes no external call or asset transfer (`target/packages/contracts/src/Raffle.sol:L276-L301`). The in-body callees are source-available view helpers, and the inherited modifier operates only on the guard storage slot (`target/packages/contracts/src/Raffle.sol:L286-L290`, `target/packages/contracts/node_modules/@openzeppelin/contracts/utils/ReentrancyGuard.sol:L69-L73`).\n- On success, `unsettledPot` becomes zero, `remainingRefundLiability` becomes the exact pre-call `unsettledPot`, and `status` becomes `Refunding` (`target/packages/contracts/src/Raffle.sol:L296-L299`).\n- Given the source-reachable precondition that `remainingRefundLiability` was zero, the reclassification preserves `accountedQuoteBalance`, whose sum includes both the unsettled and refund buckets (`target/packages/contracts/src/Raffle.sol:L296-L299`, `target/packages/contracts/src/Raffle.sol:L467-L470`).\n- Other accounting buckets, entry counts, ticket ranges, and prize custody are unchanged because they are not written in the function (`target/packages/contracts/src/Raffle.sol:L276-L301`).\n- Emits `RefundsEnabled(msg.sender, liability)` only after all three state writes; the event records the finalizer and initial aggregate refund liability defined by the interface (`target/packages/contracts/src/Raffle.sol:L296-L300`, `target/packages/contracts/src/interfaces/IRaffle.sol:L110-L113`).\n- Every rejection branch precedes the liability and lifecycle writes, so an ineligible invocation reaches none of `L296-L300` (`target/packages/contracts/src/Raffle.sol:L279-L300`).\n\n---\n\n**Block-by-Block:**\n\n```solidity\n// target/packages/contracts/src/Raffle.sol:L276-L277\nfunction enableRefunds() external override nonReentrant {\n    uint256 deadline;\n```\n\n- **What:** Exposes a parameterless external entry point, enters the shared reentrancy guard, and allocates a local deadline value (`target/packages/contracts/src/Raffle.sol:L276-L277`).\n- **Why here:** The modifier executes its entry check before any lifecycle read or write and resets the guard after the body completes (`target/packages/contracts/node_modules/@openzeppelin/contracts/utils/ReentrancyGuard.sol:L69-L73`, `target/packages/contracts/node_modules/@openzeppelin/contracts/utils/ReentrancyGuard.sol:L94-L105`).\n- **Assumes:** The namespaced guard slot is used consistently by all inherited `nonReentrant` entry points; `StorageSlot.getUint256Slot` binds the declared constant to that exact slot (`target/packages/contracts/node_modules/@openzeppelin/contracts/utils/ReentrancyGuard.sol:L35-L37`, `target/packages/contracts/node_modules/@openzeppelin/contracts/utils/ReentrancyGuard.sol:L112-L117`, `target/packages/contracts/node_modules/@openzeppelin/contracts/utils/StorageSlot.sol:L90-L97`).\n- **Establishes:** During body execution the guard slot equals `ENTERED`; any pre-state other than exact `ENTERED` passes the check, and successful exit writes `NOT_ENTERED` (`target/packages/contracts/node_modules/@openzeppelin/contracts/utils/ReentrancyGuard.sol:L50-L51`, `target/packages/contracts/node_modules/@openzeppelin/contracts/utils/ReentrancyGuard.sol:L88-L105`).\n- **Depended on by:** This invocation and every other `nonReentrant` raffle entry point share the same guard slot, including `buyEntries` and `requestDraw`, which contain external dependency calls (`target/packages/contracts/src/Raffle.sol:L209-L224`, `target/packages/contracts/src/Raffle.sol:L239-L260`).\n\n```solidity\n// target/packages/contracts/src/Raffle.sol:L279-L285\nif (status == Status.Active) {\n    if (totalEntries == 0)